{
  "results": 3,
  "page": 1,
  "resultsPerPage": 10,
  "items": [
    {
      "orderId": "56025DA7-FB0B-D680-A937-AC153207AB85",
      "orderNumber": "1003",
      "creationDate": "2009-06-29T15:36:11.000Z",
      "billingAddress": null,
      "shippingAddress": null,
      "invoicedDate": null,
      "shippedDate": null,
      "pendingDate": null,
      "archivedDate": null,
      "dispatchedDate": null,
      "viewedDate": null,
      "comment": null,
      "cancelledDate": null,
      "closedDate": null,
      "paidDate": null,
      "returnedDate": null,
      "lineItemContainer": {
        "grandTotal": null,
        "totalBeforeTax": null,
        "totalTax": null,
        "lineItemsSubTotal": null,
        "productLineItems": [],
        "shippingPrice": null
      },
      "links": [
        {
          "rel": "self",
          "href": "http://demo.epages.de:8088/rs/shops/DemoShop/orders/56025DA7-FB0B-D680-A937-AC153207AB85"
        }
      ]
    },
    {
      "orderId": "56025DA7-CC68-0B65-C26E-AC153207ABF5",
      "orderNumber": "1002",
      "creationDate": "2009-06-28T14:58:58.000Z",
      "billingAddress": null,
      "shippingAddress": null,
      "invoicedDate": null,
      "shippedDate": null,
      "pendingDate": null,
      "archivedDate": null,
      "dispatchedDate": null,
      "viewedDate": null,
      "comment": null,
      "cancelledDate": null,
      "closedDate": null,
      "paidDate": null,
      "returnedDate": null,
      "lineItemContainer": {
        "grandTotal": null,
        "totalBeforeTax": null,
        "totalTax": null,
        "lineItemsSubTotal": null,
        "productLineItems": [],
        "shippingPrice": null
      },
      "links": [
        {
          "rel": "self",
          "href": "http://demo.epages.de:8088/rs/shops/DemoShop/orders/56025DA7-CC68-0B65-C26E-AC153207ABF5"
        }
      ]
    },
    {
      "orderId": "56025DA5-CADF-1D4E-5C89-AC153207AB36",
      "orderNumber": "1001",
      "creationDate": "2009-06-21T14:45:11.000Z",
      "billingAddress": null,
      "shippingAddress": null,
      "invoicedDate": null,
      "shippedDate": null,
      "pendingDate": null,
      "archivedDate": null,
      "dispatchedDate": null,
      "viewedDate": null,
      "comment": null,
      "cancelledDate": null,
      "closedDate": null,
      "paidDate": null,
      "returnedDate": null,
      "lineItemContainer": {
        "grandTotal": null,
        "totalBeforeTax": null,
        "totalTax": null,
        "lineItemsSubTotal": null,
        "productLineItems": [],
        "shippingPrice": null
      },
      "links": [
        {
          "rel": "self",
          "href": "http://demo.epages.de:8088/rs/shops/DemoShop/orders/56025DA5-CADF-1D4E-5C89-AC153207AB36"
        }
      ]
    }
  ]
}