{
  "results": 3,
  "page": 1,
  "resultsPerPage": 10,
  "items": [
    {
      "customerId": "563874DA-7AE7-9876-9E59-D5809AB38A25",
      "customerNumber": "1027",
      "creationDate": "2015-11-03T08:48:26Z",
      "billingAddress": {
        "company": "Schneiderei",
        "salutation": "Mrs",
        "firstName": "Tanja",
        "lastName": "Schneider",
        "street": "Schneiderstra√üe 10",
        "streetDetails": null,
        "zipCode": "12345",
        "city": "Berlin",
        "state": null,
        "country": "DE",
        "title": null,
        "vatId": null,
        "birthday": null,
        "emailAddress": "schneider@schneiderei.de"
      },
      "internalNote": null,
      "links": [
        {
          "rel": "self",
          "href": "https://pm.epages.com/rs/shops/apidocu/customers/563874DA-7AE7-9876-9E59-D5809AB38A25"
        },
        {
          "rel": "orders",
          "href": "https://pm.epages.com/rs/shops/apidocu/orders?customerId=563874DA-7AE7-9876-9E59-D5809AB38A25"
        }
      ]
    },
    {
      "customerId": "56389403-55BC-176C-5343-D5809AB3A579",
      "customerNumber": "1028",
      "creationDate": "2015-11-03T11:01:23Z",
      "billingAddress": {
        "company": "Boehm-Jacobs",
        "salutation": null,
        "firstName": "Walter",
        "lastName": "Ankunding",
        "street": "Barrows Mountain 8",
        "streetDetails": null,
        "zipCode": "89708-4738",
        "city": "Lunaview",
        "state": null,
        "country": "GB",
        "title": null,
        "vatId": null,
        "birthday": "1975-11-08",
        "emailAddress": "Ankunding@bj.com"
      },
      "internalNote": null,
      "links": [
        {
          "rel": "self",
          "href": "https://pm.epages.com/rs/shops/apidocu/customers/56389403-55BC-176C-5343-D5809AB3A579"
        },
        {
          "rel": "orders",
          "href": "https://pm.epages.com/rs/shops/apidocu/orders?customerId=56389403-55BC-176C-5343-D5809AB3A579"
        }
      ]
    },
    {
      "customerId": "5638A1B2-0580-CA34-5DB3-D5809AB3A51C",
      "customerNumber": "1029",
      "creationDate": "2015-11-03T11:59:46Z",
      "billingAddress": {
        "company": "Ryan and Sons",
        "salutation": "Mr",
        "firstName": "Aaron",
        "lastName": "Grady",
        "street": "Ardith Route 2",
        "streetDetails": null,
        "zipCode": "16772-2059",
        "city": "Buckborough",
        "state": "GA",
        "country": "US",
        "title": "PhD",
        "vatId": null,
        "birthday": null,
        "emailAddress": "aaron@RyanandSons.com"
      },
      "internalNote": null,
      "links": [
        {
          "rel": "self",
          "href": "https://pm.epages.com/rs/shops/apidocu/customers/5638A1B2-0580-CA34-5DB3-D5809AB3A51C"
        },
        {
          "rel": "orders",
          "href": "https://pm.epages.com/rs/shops/apidocu/orders?customerId=5638A1B2-0580-CA34-5DB3-D5809AB3A51C"
        }
      ]
    }
  ]
}
