{
  "results": 3,
  "page": 1,
  "resultsPerPage": 10,
  "items": [
    {
      "orderId": "5639C509-092F-7704-77D3-D5809AB321D8",
      "orderNumber": "ORD151104/1033",
      "creationDate": "2015-11-04T08:42:49.000Z",
      "billingAddress": {
        "company": "Boehm-Jacobs",
        "salutation": null,
        "firstName": "Walter",
        "lastName": "Ankunding",
        "street": "Barrows Mountain 8",
        "streetDetails": null,
        "zipCode": "W11 1ET",
        "city": "London",
        "state": null,
        "country": "UK",
        "title": null,
        "vatId": null,
        "birthday": "1975-11-08",
        "emailAddress": "Ankunding@bj.com"
      },
      "shippingAddress": null,
      "shippingData": {
        "shippingMethod": {
          "id": "5171DD86-C077-0726-C448-AC14145F9026",
          "name": "Standard delivery"
        },
        "price": {
          "taxType": "GROSS",
          "formatted": "7.00 €",
          "amount": 7,
          "currency": "EUR"
        }
      },
      "paymentData": {
        "paymentMethod": {
          "id": "5171DD86-0714-8E9B-B079-AC14145F900F",
          "name": "Payment in advance"
        },
        "price": {
          "taxType": "GROSS",
          "formatted": "0.00 €",
          "amount": 0,
          "currency": "EUR"
        }
      },
      "invoicedOn": null,
      "partiallyPaidOn": null,
      "deliveredOn": null,
      "partiallyInvoicedOn": null,
      "pendingOn": null,
      "readyForDispatchOn": null,
      "partiallyDispatchedOn": null,
      "archivedOn": null,
      "dispatchedOn": null,
      "viewedOn": "2015-11-04T11:45:07.000Z",
      "customerNumber": "1031",
      "customerId": "56389403-55BC-176C-5343-D5809AB3A579",
      "locale": null,
      "currencyId": "EUR",
      "taxModel": "GROSS",
      "grandTotal": "250.94",
      "totalBeforeTax": "250.94",
      "totalTax": "0",
      "customerComment": null,
      "internalNote": null,
      "rejectedOn": null,
      "inProcessOn": null,
      "closedOn": null,
      "paidOn": "2016-01-20T07:23:47.000Z",
      "returnedOn": null,
      "links": [
        {
          "rel": "self",
          "href": "https://pm.epages.com/rs/shops/apidocu/orders/5639C509-092F-7704-77D3-D5809AB321D8"
        },
        {
          "rel": "customer",
          "href": "https://pm.epages.com/rs/shops/apidocu/customers/56389403-55BC-176C-5343-D5809AB3A579"
        },
        {
          "rel": "shipping-method",
          "href": "https://pm.epages.com/rs/shops/apidocu/shipping-methods/5171DD86-C077-0726-C448-AC14145F9026"
        }
      ]
    },
    {
      "orderId": "5639C473-4265-5299-FDE2-D5809AB36284",
      "orderNumber": "ORD151104/1032",
      "creationDate": "2015-11-04T08:40:17.000Z",
      "customerId": "563874DA-7AE7-9876-9E59-D5809AB38A25",
      "customerNumber": "1027",
      "locale": "de_DE",
      "currencyId": "EUR",
      "taxModel": "GROSS",
      "grandTotal": "9.99",
      "totalBeforeTax": "8.39",
      "totalTax": "1.6",
      "customerComment": "I need the product asap",
      "internalNote": "Tracking code:YAZUN7989",
      "billingAddress": {
        "company": "Schneiderei",
        "salutation": "Mrs",
        "firstName": "Tanja",
        "lastName": "Schneider",
        "street": "Schneiderstraße 10",
        "streetDetails": null,
        "zipCode": "12345",
        "city": "Berlin",
        "state": null,
        "country": "DE",
        "title": null,
        "vatId": null,
        "birthday": null,
        "emailAddress": "schneider@schneiderei.de"
      },
      "shippingAddress": null,
      "shippingData": null,
      "paymentData": {
        "paymentMethod": {
          "id": "5171DD86-0714-8E9B-B079-AC14145F900F",
          "name": "Payment in advance"
        },
        "price": {
          "taxType": "GROSS",
          "formatted": "0.00 €",
          "amount": 0,
          "currency": "EUR"
        }
      },
      "viewedOn": "2015-11-04T08:41:35.000Z",
      "rejectedOn": null,
      "inProcessOn": null,
      "pendingOn": null,
      "readyForDispatchOn": null,
      "partiallyDispatchedOn": null,
      "dispatchedOn": "2015-11-04T08:41:35.000Z",
      "deliveredOn": "2015-11-04T08:41:35.000Z",
      "partiallyInvoicedOn": null,
      "invoicedOn": null,
      "partiallyPaidOn": null,
      "paidOn": "2015-11-04T08:41:35.000Z",
      "returnedOn": null,
      "closedOn": null,
      "archivedOn": null,
      "links": [
        {
          "rel": "self",
          "href": "https://pm.epages.com/rs/shops/apidocu/orders/5639C473-4265-5299-FDE2-D5809AB36284"
        },
        {
          "rel": "customer",
          "href": "https://pm.epages.com/rs/shops/apidocu/customers/563874DA-7AE7-9876-9E59-D5809AB38A25"
        }
      ]
    },
    {
      "orderId": "5638C3E4-03B6-9023-DE5B-D5809AB3777D",
      "orderNumber": "ORD151103/1031",
      "creationDate": "2015-11-03T14:25:40.000Z",
      "customerId": "5638A1B2-0580-CA34-5DB3-D5809AB3A51C",
      "customerNumber": "1029",
      "locale": "de_DE",
      "currencyId": "EUR",
      "taxModel": "GROSS",
      "grandTotal": "196.05",
      "totalBeforeTax": "196.05",
      "totalTax": "0",
      "customerComment": "Please deliver asap.",
      "internalNote": null,
      "billingAddress": {
        "company": "Ryan and Sons",
        "salutation": "Mr",
        "firstName": "Aaron",
        "lastName": "Grady",
        "street": "Ardith Route 2",
        "streetDetails": null,
        "zipCode": "16772-2059",
        "city": "Buckborough",
        "state": "GA",
        "country": "US",
        "title": "PhD",
        "vatId": null,
        "birthday": null,
        "emailAddress": "aaron@RyanandSons.com"
      },
      "shippingAddress": null,
      "shippingData": {
        "shippingMethod": {
          "id": "5171DD86-C077-0726-C448-AC14145F9026",
          "name": "Standard delivery"
        },
        "price": {
          "taxType": "GROSS",
          "formatted": "7.32 €",
          "amount": 7.32,
          "currency": "EUR"
        }
      },
      "paymentData": {
        "paymentMethod": {
          "id": "5171DD86-0714-8E9B-B079-AC14145F900F",
          "name": "Payment in advance"
        },
        "price": {
          "taxType": "GROSS",
          "formatted": "0.00 €",
          "amount": 0,
          "currency": "EUR"
        }
      },
      "viewedOn": "2015-11-03T14:48:50.000Z",
      "rejectedOn": null,
      "inProcessOn": null,
      "pendingOn": null,
      "readyForDispatchOn": null,
      "partiallyDispatchedOn": null,
      "dispatchedOn": null,
      "deliveredOn": null,
      "partiallyInvoicedOn": null,
      "invoicedOn": null,
      "partiallyPaidOn": null,
      "paidOn": null,
      "returnedOn": null,
      "closedOn": null,
      "archivedOn": null,
      "links": [
        {
          "rel": "self",
          "href": "https://pm.epages.com/rs/shops/apidocu/orders/5638C3E4-03B6-9023-DE5B-D5809AB3777D"
        },
        {
          "rel": "customer",
          "href": "https://pm.epages.com/rs/shops/apidocu/customers/5638A1B2-0580-CA34-5DB3-D5809AB3A51C"
        },
        {
          "rel": "shipping-method",
          "href": "https://pm.epages.com/rs/shops/apidocu/shipping-methods/5171DD86-C077-0726-C448-AC14145F9026"
        }
      ]
    }
  ]
}
